{
  "schema_version": "clipmill.vision.face_track.v1",
  "source_fingerprint": "sha256:aaaaaaaaaaaaaaaaaaaaaaaaaaaaaaaaaaaaaaaaaaaaaaaaaaaaaaaaaaaaaaaa",
  "frames_artifact_id": "sha256:bbbbbbbbbbbbbbbbbbbbbbbbbbbbbbbbbbbbbbbbbbbbbbbbbbbbbbbbbbbbbbbb",
  "producer": {
    "stage": "detect-faces",
    "implementation": "clipmill-worker-faces@0.1.1+yunet-2023mar+mouth-1",
    "model_digest": "sha256:8f2383e4dd3cfbb4553ea8718107fc0423210dc964f9f4280604804ed2552fa4"
  },
  "detection": {
    "score_threshold": 0.6,
    "nms_iou": 0.3,
    "input_width": 320,
    "input_height": 320,
    "match_iou": 0.5,
    "recover_iou": 0.3,
    "max_gap_frames": 6,
    "min_track_frames": 4,
    "frame_rate": {
      "num": 4,
      "den": 1
    }
  },
  "coverage": {
    "start_ticks": 0,
    "end_ticks": 900000,
    "analyzed": true,
    "frames_examined": 40
  },
  "tracks": [
    {
      "track_id": 0,
      "first_ticks": 0,
      "last_ticks": 675000,
      "frames_present": 3,
      "mean_score": 0.9,
      "boxes": [
        {
          "t_ticks": 0,
          "x": 0.2,
          "y": 0.25,
          "w": 0.16,
          "h": 0.26,
          "score": 0.93
        },
        {
          "t_ticks": 225000,
          "x": 0.21,
          "y": 0.25,
          "w": 0.16,
          "h": 0.26,
          "score": 0.88,
          "mouth_motion": 0.21
        },
        {
          "t_ticks": 450000,
          "x": 0.22,
          "y": 0.25,
          "w": 0.16,
          "h": 0.26,
          "score": 0.89,
          "interpolated": true
        },
        {
          "t_ticks": 675000,
          "x": 0.23,
          "y": 0.26,
          "w": 0.16,
          "h": 0.26,
          "score": 0.89,
          "mouth_motion": 0.21
        }
      ]
    },
    {
      "track_id": 1,
      "first_ticks": 0,
      "last_ticks": 225000,
      "frames_present": 2,
      "mean_score": 0.71,
      "boxes": [
        {
          "t_ticks": 0,
          "x": 0.62,
          "y": 0.27,
          "w": 0.15,
          "h": 0.24,
          "score": 0.74
        },
        {
          "t_ticks": 225000,
          "x": 0.63,
          "y": 0.27,
          "w": 0.15,
          "h": 0.24,
          "score": 0.68,
          "mouth_motion": 0.05
        }
      ]
    }
  ]
}
